{"core_snapshot_revision":7,"generated_at":"2026-08-27T00:00:00Z","ordered_revisions":[{"content_asset_id":"asset-content-a","content_hash":"1111111111111111111111111111111111111111111111111111111111111111","document_id":"doc-a","document_type":"core.chapter","encoding":"utf-8","mime":"text/plain","ordinal":0,"revision_id":"rev-a","title":"Chapter A"},{"content_asset_id":"asset-content-b","content_hash":"2222222222222222222222222222222222222222222222222222222222222222","document_id":"doc-b","document_type":"core.chapter","encoding":"utf-8","mime":"text/plain","ordinal":1,"revision_id":"rev-b","title":"Chapter B"}],"schema":"export-current-revisions/v1","workspace_id":"ws-1"}